{
  "$schema": "https://json-schema.org/draft/2020-12/schema",
  "$id": "film_shots.schema.json",
  "title": "Film shot cards (versions 1 and 2; /2 adds the lane, frame geometry and fps, docs/CONTRACTS.md): the animated shots of an approved script, from which every picture, video and sound prompt is composed (docs/SHOT_PROMPTS.md, KP-15..KP-40)",
  "type": "object",
  "required": ["schema", "episode", "style", "cast", "places", "shots"],
  "additionalProperties": false,
  "$defs": {
    "text": {"type": "string", "minLength": 1},
    "where": {"enum": ["left", "center", "right", "left_back", "center_back", "right_back", "left_front", "right_front"]},
    "person": {
      "type": "object",
      "required": ["who", "where", "facing"],
      "additionalProperties": false,
      "properties": {
        "who": {"type": "string", "description": "a cast id"},
        "where": {"$ref": "#/$defs/where"},
        "facing": {"type": "string", "description": "camera, left, right, away, or a cast id this person looks at"},
        "pose": {"type": "string", "description": "the visible pose in the shot's FIRST frame (the start of the action)"},
        "on": {"type": "string", "description": "what the person stands, sits or lies on, as a phrase: 'standing on the packed snow', 'sitting on the bus step' (KP-31)"},
        "height": {"enum": ["quarter", "third", "half", "two_thirds", "most"], "description": "how much of the frame height the figure fills (KP-32)"},
        "height_pct": {"type": "integer", "minimum": 5, "maximum": 100, "description": "the same as a number, for the keyframe gate; the prompt says the nearest word, never the number (KP-32)"},
        "partial": {"type": "string", "description": "only this part of the figure is in the frame ('the trunk', 'one hand'): written as such, counted by the gate, no support or height needed"}
      }
    }
  },
  "properties": {
    "schema": {"enum": ["film_shots/1", "film_shots/2"]},
    "fps": {"type": "integer", "minimum": 1, "description": "film_shots/2: the episode's frame rate (D-85, CN-09)"},
    "scene_sets": {"type": "array", "items": {"type": "string"}, "description": "film_shots/2: scene_set/1 files next to this file"},
    "episode": {"$ref": "#/$defs/text"},
    "script": {"type": "string", "description": "the approved production script these shots film (path next to this file)"},
    "style": {
      "type": "object",
      "required": ["trigger", "video_sentence"],
      "additionalProperties": false,
      "properties": {
        "trigger": {"$ref": "#/$defs/text", "description": "the style LoRA's trigger, first words of every keyframe prompt"},
        "video_sentence": {"$ref": "#/$defs/text", "description": "ONE fixed style sentence, first in every video prompt (KP-10)"},
        "neg_keyframe": {"type": "string", "description": "LT-66 A3: only style_prompt.NEGATIVE itself is accepted"},
        "body": {"type": "string", "description": "the caricature body words every moment gives its lead (LT-65)"},
        "look": {"description": "AC-16: the episode look file (episode_look/1, path next to this file) or its phrase and lights",
                 "oneOf": [{"type": "string"},
                           {"type": "object", "required": ["phrase"],
                            "properties": {"phrase": {"type": "string"},
                                           "lights": {"type": "object", "additionalProperties": {"type": "string"}}}}]},
        "neg_video": {"type": "string"}
      }
    },
    "cast": {
      "type": "object",
      "minProperties": 1,
      "additionalProperties": {
        "type": "object",
        "required": ["tag"],
        "additionalProperties": false,
        "properties": {
          "name": {"type": "string", "description": "the story name; never written into a prompt (KP-22)"},
          "tag": {"$ref": "#/$defs/text", "description": "the one visible identity tag, the same words in every prompt (KP-15)"},
          "voice": {"type": "string", "description": "how the voice sounds, for the video model's dialogue (never a person's name)"}
        }
      }
    },
    "places": {"type": "object", "additionalProperties": {"$ref": "#/$defs/text"}},
    "absent": {"type": "array", "items": {"type": "string"},
               "description": "KG-21: the world's absent things, checked in every drawn frame ('a city', 'a paved road')"},
    "engine": {"const": "script_engine/1",
               "description": "the cards follow the script engine v1 (docs/SCRIPT_ENGINE.md): the episode rules KP-35..KP-40 and ZI-02/ZI-03 apply"},
    "claims": {"type": "object", "description": "the claim map: id -> the fact and its source (ZI-02)",
               "additionalProperties": {"type": "object", "required": ["text", "source"], "additionalProperties": false,
                                        "properties": {"text": {"$ref": "#/$defs/text"}, "source": {"$ref": "#/$defs/text"},
                                                       "kind": {"enum": ["fact", "estimate", "invented"]}}}},
    "channel": {"type": "object", "additionalProperties": false, "required": ["worlds_on", "worlds_coming"],
                "description": "the outro's channel pointer (BP-106): worlds already on the channel and worlds coming",
                "properties": {"worlds_on": {"type": "array", "items": {"$ref": "#/$defs/text"}, "minItems": 1},
                               "worlds_coming": {"type": "array", "items": {"$ref": "#/$defs/text"}, "minItems": 1}}},
    "shots": {
      "type": "array",
      "minItems": 1,
      "items": {
        "type": "object",
        "required": ["id", "scene", "mode", "beat", "seconds", "frame", "source"],
        "additionalProperties": false,
        "properties": {
          "id": {"type": "string", "pattern": "^[A-Za-z0-9_.-]+$"},
          "scene": {"type": "string", "description": "the script segment (S01..) this shot belongs to"},
          "line": {"type": "integer", "minimum": 0, "description": "index of the script line it plays, when it plays one"},
          "mode": {"enum": ["scene", "narrated", "establish", "insert"],
                   "description": "scene = sync dialogue or acting in the drama; narrated = the narrator speaks over it, nobody in frame speaks; establish = place and time; insert = a prop or a detail, no face"},
          "beat": {"$ref": "#/$defs/text", "description": "what this shot does for the story, one sentence (KP-28)"},
          "seconds": {"type": "number", "exclusiveMinimum": 0, "maximum": 20},
          "frame": {
            "type": "object",
            "required": ["size", "place"],
            "additionalProperties": false,
            "properties": {
              "size": {"enum": ["EWS", "WS", "MWS", "MS", "MCU", "CU", "ECU", "OTS", "INSERT"]},
              "angle": {"enum": ["eye", "low", "high", "overhead", "dutch"]},
              "camera": {"enum": ["static", "push_in", "pull_out", "pan_left", "pan_right", "tilt_up", "tilt_down",
                                  "follow", "truck_left", "truck_right"]},
              "camera_end": {"type": "string", "description": "how the frame looks after the move (LTX completes a move it can see the end of)"},
              "over": {"type": "string", "description": "OTS: the cast id whose shoulder is in the foreground"},
              "place": {"type": "string", "description": "a key of places"},
              "light": {"type": "string"},
              "look": {"type": "string", "description": "a named light variant of the episode look (AC-17: night, interior ...)"},
              "things": {"type": "object", "description": "KG-01: exact counts of objects in the picture, {name: count}",
                         "additionalProperties": {"oneOf": [{"type": "integer", "minimum": 0},
                                                            {"type": "object", "required": ["count"], "additionalProperties": false,
                                                             "properties": {"count": {"type": "integer", "minimum": 0},
                                                                            "plural": {"type": "string"}}}]}},
              "absent": {"type": "array", "items": {"type": "string"},
                         "description": "KG-21: things that must not be in this picture ('a building', 'a road')"},
              "crosses_line": {"type": "boolean", "description": "true only when the shot means to cross the 180-degree line"},
              "relations": {"type": "array", "items": {"$ref": "#/$defs/text"},
                            "description": "unambiguous relations between things in the picture, one sentence each: 'a living woolly mammoth stands behind the boulder' (KP-33)"},
              "lead_room": {
                "type": "object",
                "required": ["side"],
                "additionalProperties": false,
                "description": "the free space the action moves into (KP-34); side none = the action stays in place",
                "properties": {"side": {"enum": ["left", "right", "above", "below", "none"]},
                               "for": {"type": "string", "description": "what the space is for: 'where he will fall'"}}
              }
            }
          },
          "blocking": {"type": "array", "items": {"$ref": "#/$defs/person"}},
          "action": {
            "type": "object",
            "required": ["who", "start", "peak", "settle"],
            "additionalProperties": false,
            "properties": {
              "who": {"type": "string"},
              "start": {"$ref": "#/$defs/text", "description": "the anticipation: what the first frame shows"},
              "peak": {"$ref": "#/$defs/text", "description": "the big move, with body parts"},
              "settle": {"$ref": "#/$defs/text", "description": "the end pose the shot holds (and the last frame, if guided)"},
              "face": {"type": "string", "description": "the emotion as the lens sees it: eyes, brows, mouth, shoulders"}
            }
          },
          "reactions": {
            "type": "array",
            "items": {
              "type": "object",
              "required": ["who", "does"],
              "additionalProperties": false,
              "properties": {"who": {"type": "string"}, "does": {"$ref": "#/$defs/text"}}
            }
          },
          "dialogue": {
            "type": "object",
            "required": ["who", "to", "text"],
            "additionalProperties": false,
            "properties": {
              "who": {"type": "string"},
              "to": {"type": "string", "description": "a cast id present, or room / self"},
              "text": {"$ref": "#/$defs/text"},
              "delivery": {"type": "string", "description": "how it is said: pace, loudness, colour (from the performance-director)"},
              "language": {"type": "string"}
            }
          },
          "narration": {"type": "string", "description": "the narrator's words over this shot (mode narrated); never what the picture already shows"},
          "sound": {
            "type": "object",
            "additionalProperties": false,
            "properties": {
              "ambience": {"type": "string"},
              "foley": {"type": "array", "items": {"type": "string"}},
              "loudest": {"type": "string", "description": "the one loud sound, said once"},
              "diegetic_music": {"type": "string", "description": "music with a visible source in the shot (a radio, a band); score music belongs to the edit"}
            }
          },
          "source": {"enum": ["keyframe", "nextpose", "cut"],
                     "description": "how the first frame is drawn: a new keyframe, a next pose of the scene's master, or a cut (new size or angle) of the same scene"},
          "master": {"type": "string", "description": "nextpose / cut: the shot id whose keyframe is the scene's master"},
          "teaser_of": {"type": "string", "description": "KP-41: this shot is a piece of a later shot's clip, shown in the cold open; nothing new is drawn or rendered"},
          "last_frame": {"type": "boolean", "description": "true: the settle pose is drawn too (a next pose of the master) and guides the clip's last frame"},
          "exit": {"type": "boolean"},
          "tier": {"enum": ["hold", "light", "full"],
                   "description": "the animation budget (KP-37): hold = the keyframe with a camera move by our code; light = a small move (breath, glance, turn of the head) on the fast model; full = the acting, every line and every peak"},
          "claims": {"type": "array", "items": {"type": "string"}, "description": "claim ids of the facts the narration says (ZI-02)"},
          "lane": {"enum": ["KEYFRAME_LTX", "DIALOGUE_CU", "HOST_COMMENTARY", "DRAMA_BLOCKED_3D", "ATMOS_BROLL", "MAP", "COMPENSATOR",
                            "STILL_HOLD"], "description": "film_shots/2: how the shot is made (docs/CONTRACTS.md); the shot size stays frame.size"},
          "archetype": {"type": "string", "minLength": 1, "description": "film_shots/2: an id of the P5 visual archetype catalogue"},
          "duration_frames": {"type": "integer", "minimum": 1, "description": "film_shots/2: frames at the episode fps (8k+1 on a video lane, CN-08)"},
          "width": {"type": "integer", "minimum": 1},
          "height": {"type": "integer", "minimum": 1},
          "lens_tier": {"enum": ["wide", "normal", "long"]},
          "focal_xy": {"type": "array", "items": {"type": "number", "minimum": 0, "maximum": 1}, "minItems": 2, "maxItems": 2},
          "continuity_ref": {"anyOf": [{"type": "string", "minLength": 1}, {"type": "null"}], "description": "<file>#<id> of a continuity card, or null"},
          "blocking_ref": {"anyOf": [{"type": "string", "minLength": 1}, {"type": "null"}], "description": "<file>#<id> of a scene_set camera, or null"}
        }
      }
    }
  },
  "allOf": [
    {"if": {"properties": {"schema": {"const": "film_shots/2"}}, "required": ["schema"]},
     "then": {"required": ["fps"],
              "properties": {"shots": {"items": {"required": ["lane", "archetype", "duration_frames", "width", "height", "lens_tier",
                                                             "focal_xy", "continuity_ref", "blocking_ref"]}}}}}
  ]
}
